<?xml version="1.0" encoding="UTF-8"?>

<tns:responsable  xmlns:xsi="http://www.w3.org/2001/XMLSchema-instance"
             
             xmlns:tns="http://www.piat.upm.es/responsableSchema"
             xsi:schemaLocation="http://www.piat.upm.es/responsableSchema ../Fase_2/Responsable.xsd">

    <tns:colaboradores>
        <tns:colaborador>Sara</tns:colaborador>
        <tns:colaborador>Sara Jimenez </tns:colaborador>
        <tns:colaborador>Sara Jimenez MUÃ±oz</tns:colaborador>
        <tns:departamento>NombreDepartamento1</tns:departamento>
        <tns:departamento>NombreDepartamento2</tns:departamento>
    </tns:colaboradores>
    <tns:contacto>
        <tns:email>correo@gmail.com</tns:email>
        <tns:uri>https://www.paginaweb.com</tns:uri>
    </tns:contacto>

</tns:responsable>
